{
  "medicine": "Digoxin",
  "condition": "Heart failure",
  "study_identifier": "DECISION",
  "source_identifier": "SRC-PMID-42108270",
  "women_represented": "yes",
  "women_count": 284,
  "women_percentage": 28.0,
  "sex_specific_effectiveness": "reported",
  "formal_sex_comparison": "reported",
  "interaction_statistic": "Adjusted sex-by-treatment interaction: P = 0.014",
  "sex_specific_safety": "reported",
  "menopause": "not_reported",
  "pregnancy": "not_reported",
  "hormone_therapy": "not_reported",
  "hormonal_variability": "not_reported",
  "race_and_ethnicity": "not_located",
  "age": "Minimum age 21 Years (age eligibility only; not a menopause claim)",
  "evidence_state": "complete",
  "exact_evidence_passage": "primary endpoint between women and men (rate ratio digoxin versus placebo: 0.71 and 0.85, respectively, P value for interaction 0.61) (Fig. 3 ).",
  "source_url": "https://www.nature.com/articles/s41591-026-04406-6",
  "extraction_model": "recorded-corpus-v3.0.0",
  "prompt_version": "evidence-extraction-v0.1",
  "schema_version": "0.2",
  "extraction_timestamp": "2026-07-20T18:42:00Z",
  "validation_state": "quote_verified",
  "validation_notes": "quote verified verbatim against the stored source.",
  "human_review_state": "not_reviewed",
  "human_reviewer": null
}