{
  "medicine": "Valsartan",
  "condition": "Hypertension",
  "study_identifier": "HAYOZ-2012",
  "source_identifier": "SRC-PMC8108841",
  "women_represented": "yes",
  "women_count": 125,
  "women_percentage": 100.0,
  "sex_specific_effectiveness": "reported",
  "formal_sex_comparison": "not_applicable",
  "interaction_statistic": null,
  "sex_specific_safety": "reported",
  "menopause": "reported",
  "pregnancy": "not_reported",
  "hormone_therapy": "reported",
  "hormonal_variability": "not_reported",
  "race_and_ethnicity": "not_located",
  "age": "Minimum age 50 Years (age eligibility only; not a menopause claim)",
  "evidence_state": "complete",
  "exact_evidence_passage": "rted AE was peripheral edema, affecting 77.4% and 14.3% patients in the amlodipine and valsartan treatment groups, respectively.",
  "source_url": "https://pmc.ncbi.nlm.nih.gov/articles/PMC8108841/",
  "extraction_model": "recorded-corpus-v3.0.0",
  "prompt_version": "evidence-extraction-v0.1",
  "schema_version": "0.2",
  "extraction_timestamp": "2026-07-20T18:42:00Z",
  "validation_state": "quote_verified",
  "validation_notes": "quote verified verbatim against the stored source.",
  "human_review_state": "not_reviewed",
  "human_reviewer": null
}